<?xml version="1.0"  standalone="no"?>
<screen xmlns:xsi="http://www.w3.org/2001/XMLSchema-instance" xsi:noNamespaceSchemaLocation="screenSchema.xsd"
        atlas="settings" localized="false" defaultBackground="true">
    <element name="sounds" region="soundOn" secondRegion="soundOff" localized="false"
            x="79" y="377"/>
    <element name="vibrate" region="vibrationOn" secondRegion="vibrationOff" localized="false"
            x="265" y="372"/>
    <element name="ru" region="languageRussianOn" secondRegion="languageRussianOff" localized="false"
            x="73" y="231"/>
    <element name="en" region="languageEnglishOn" secondRegion="languageEnglishOff" localized="false"
            x="236" y="231"/>
    <element name="slow" region="speedSlowOn" secondRegion="speedSlowOff" localized="true"
            x="0" y="84"/>
    <element name="normal" region="speedNormalOn" secondRegion="speedNormalOff" localized="true"
            x="138" y="84"/>
    <element name="fast" region="speedFastOn" secondRegion="speedFastOff" localized="true"
            x="312" y="84"/>
    <element name="settingsText" region="settingsText" localized="true"
             x="108" y="605"/>
</screen>